{
    "kind": "{schema_authority}:wks:work-product-component--SamplesAnalysis:{wpc_version}",
    "acl": {
        "viewers": [
            "{acl_viewers}"
        ],
        "owners": [
            "{acl_owners}"
        ]
    },
    "legal": {
        "legaltags": [
            "{legal_tag}"
        ],
        "otherRelevantDataCountries": [
            "US"
        ],
        "status": "compliant"
    },
    "tags": {
        "NameOfKey": "String value"
    },
    "data": {
        "Name": "Sample Analysis integration test",
        "SampleIDs": [
            "{data_partition_id}:master-data--Sample:Rafsddms_Integration_Test:"
        ],
        "ReportSampleIdentifiers": [
            "53B"
        ],
        "AnalysisDate": "2015-01-01",
        "LaboratoryIDs": [
            "{data_partition_id}:master-data--Organisation:GenericOrganisation_007:"
        ],
        "LaboratoryNames": [
            "TestLab"
        ],
        "Remarks": [
            {
                "Remark": "Kentish Knock South 1 - Special Core Analysis (SCAL) Report, Section 6.2 Page 91, 92",
                "RemarkSequenceNumber": 1,
                "RemarkSource": "RAFSDDMS",
                "RemarkDate": "2023-12-21"
            }
        ],
        "DatePublished": "2015-01-01",
        "ParentSamplesAnalysesReports": [
            {
                "ParentSamplesAnalysesReportID": "{parent_report_id}:"
            }
        ],
        "SampleAnalysisTypeIDs": [
            "{data_partition_id}:reference-data--SampleAnalysisType:{samples_analysis_type}:"
        ],
        "SamplesAnalysisCategoryTagIDs": [
            "{data_partition_id}:reference-data--SamplesAnalysisCategoryTag:GreenCompany.SCAL:"
        ],
        "DDMSDatasets": [],
        "Parameters": []
    }
}
