[
    {
        "id": "namespace:work-product-component--SaturationFunctionSet:aaf89bee-71f1-5af1-a3a5-9a25f56ba1a6",
        "kind": "osdu:wks:work-product-component--SaturationFunctionSet:1.0.0",
        "version": 1562066009929332,
        "acl": {
            "owners": [
                "someone@company.com"
            ],
            "viewers": [
                "someone@company.com"
            ]
        },
        "legal": {
            "legaltags": [
                "Example legaltags"
            ],
            "otherRelevantDataCountries": [
                "US"
            ],
            "status": "compliant"
        },
        "tags": {
            "NameOfKey": "String value"
        },
        "createTime": "2020-12-16T11:46:20.163Z",
        "createUser": "some-user@some-company-cloud.com",
        "modifyTime": "2020-12-16T11:52:24.477Z",
        "modifyUser": "some-user@some-company-cloud.com",
        "ancestry": {
            "parents": []
        },
        "meta": [],
        "data": {
            "ThreePhaseRelativePermeabilityModelTypeID": "namespace:reference-data--ThreePhaseRelativePermeabilityModelType:Baker:",
            "SaturationFunctions": [
                {
                    "FunctionName": "Example Function Name",
                    "FunctionUsageTypeID": "namespace:reference-data--SaturationFunctionUsageType:Imbibition:",
                    "BasisOfModelling": {
                        "CapillaryPressureInputDataCollectionID": "namespace:work-product-component--PersistedCollection:PersistedCollection-911bb71f-06ab-4deb-8e68-b8c9229dc76b:",
                        "CapillaryPressureInputSampleAnalysisIDs": [
                            "namespace:work-product-component--SamplesAnalysis:SamplesAnalysis-911bb71f-06ab-4deb-8e68-b8c9229dc76b:"
                        ],
                        "RelativePermeabilityInputDataCollectionID": "namespace:work-product-component--PersistedCollection:PersistedCollection-911bb71f-06ab-4deb-8e68-b8c9229dc76b:",
                        "RelativePermeabilityInputSampleAnalysisIDs": [
                            "namespace:work-product-component--SamplesAnalysis:SamplesAnalysis-911bb71f-06ab-4deb-8e68-b8c9229dc76b:"
                        ],
                        "ModellingApplicationsUsed": [
                            "Example ModellingApplicationsUsed"
                        ],
                        "IntendedWorkflowUsageIDs": [
                            "namespace:reference-data--WorkflowUsageType:All:"
                        ]
                    },
                    "DatePublished": "2020-02-13T09:13:15.55Z",
                    "ModellingContacts": [
                        {
                            "EmailAddress": "support@company.com",
                            "PhoneNumber": "1-555-281-5555",
                            "RoleTypeID": "namespace:reference-data--ContactRoleType:AccountOwner:",
                            "DataGovernanceRoleTypeID": "namespace:reference-data--DataGovernanceRoleType:ExecutiveSponsor:",
                            "WorkflowPersonaTypeID": "namespace:reference-data--WorkflowPersonaType:All:",
                            "Comment": "Example Comment",
                            "OrganisationID": "namespace:master-data--Organisation:SomeUniqueOrganisationID:",
                            "Name": "Example Name"
                        }
                    ],
                    "ModelAreaOfInterestIDs": [
                        "namespace:work-product-component--WellboreIntervalSet:WellboreIntervalSet-911bb71f-06ab-4deb-8e68-b8c9229dc76b:"
                    ],
                    "HasRelativePermeability": true,
                    "HasCapillaryPressure": true
                }
            ],
            "Remarks": [
                {
                    "RemarkSequenceNumber": 1,
                    "Remark": "Example Remark",
                    "RemarkSource": "Example Remark Source",
                    "RemarkDate": "2020-02-13"
                }
            ],
            "ParentModelID": "namespace:work-product-component--SaturationFunctionSet:SaturationFunctionSet-911bb71f-06ab-4deb-8e68-b8c9229dc76b:",
            "ExtensionProperties": {}
        }
    }
]
